{
  "schema_name": "repair-plan",
  "schema_version": "1.0.0",
  "plan_id": "plan-dddddddddddddddddddddddd",
  "case_id": "case-aaaaaaaaaaaaaaaaaaaaaaaa",
  "finding_refs": ["finding-cccccccccccccccccccccccc"],
  "steps": [
    {
      "step_id": "step-1",
      "operation_id": "boot.inspect_bcd",
      "operation_version": "1.0.0",
      "target_id": "target-disk-nvme0n1",
      "depends_on": [],
      "approval_required": false,
      "backup_required": false
    }
  ],
  "risk_summary": "Read-only BCD inspection only.",
  "backup_requirements": [],
  "approval_requirements": [],
  "status": "ready"
}
